{
  "schema_version": "storyworld.skill-library.registry.v1",
  "library_version": "1.0.0",
  "generated_on": "2026-08-01",
  "assessed_storyworld_commit": "fc9b75b8ae3f28b4b9e13f5c0e31e9f2d24ad565",
  "status": "generated_unadopted_library",
  "permission_grant": false,
  "count": 33,
  "skills": [
    {
      "id": "storyworld-engineering",
      "version": "1.0.0",
      "display_name": "Storyworld Engineering",
      "description": "Route Storyworld engineering work to the smallest applicable governed skill set. Use for repository build, architecture, contract, integration, Studio, evaluation, security, POC, and conformance tasks.",
      "purpose": "Serve as the umbrella router for Storyworld engineering without becoming a competing governance or implementation authority.",
      "category": "routing",
      "tier": "foundation",
      "priority": "P0",
      "adoption_wave": "A-governance-foundation",
      "adoption_status": "generated_unadopted_baseline",
      "permission_grant": false,
      "side_effects": "repository_local_as_authorized_by_current_task",
      "entrypoint": ".agents/skills/storyworld-engineering/SKILL.md",
      "dependencies": [
        "storyworld-repository-orientation",
        "storyworld-governed-change",
        "storyworld-conformance-and-release"
      ],
      "decisions": [
        "DEC-0040 through DEC-0053 (proposed integration-architecture successors)"
      ],
      "contracts": [],
      "pocs": [],
      "repository_paths": [
        "AGENTS.md",
        ".agent/",
        ".agents/",
        "project-dossier/",
        "project-dossier-intake/",
        "packages/",
        "apps/studio/"
      ],
      "profiles": [],
      "files": [
        ".agents/skills/storyworld-engineering/SKILL.md",
        ".agents/skills/storyworld-engineering/agents/openai.yaml",
        ".agents/skills/storyworld-engineering/references/checklist.md",
        ".agents/skills/storyworld-engineering/references/failure-cases.md",
        ".agents/skills/storyworld-engineering/references/output-contract.md",
        ".agents/skills/storyworld-engineering/references/provenance.json"
      ]
    },
    {
      "id": "storyworld-repository-orientation",
      "version": "1.0.0",
      "display_name": "Storyworld Repository Orientation",
      "description": "Establish the exact Storyworld repository, governance, dossier, decision, task, package, test, and implementation context before significant work.",
      "purpose": "Produce a compact, evidence-backed context package so later skills do not rely on stale prose or inferred repository state.",
      "category": "governance",
      "tier": "foundation",
      "priority": "P0",
      "adoption_wave": "A-governance-foundation",
      "adoption_status": "generated_unadopted_baseline",
      "permission_grant": false,
      "side_effects": "read_only",
      "entrypoint": ".agents/skills/storyworld-repository-orientation/SKILL.md",
      "dependencies": [],
      "decisions": [],
      "contracts": [],
      "pocs": [],
      "repository_paths": [
        "AGENTS.md",
        ".agent/START_HERE.md",
        ".agent/policy.json",
        ".agent/context.json",
        ".agent/state/current.json",
        ".agent/decisions/",
        ".agent/tasks/",
        "project-dossier/",
        "project-dossier-intake/"
      ],
      "profiles": [],
      "files": [
        ".agents/skills/storyworld-repository-orientation/SKILL.md",
        ".agents/skills/storyworld-repository-orientation/agents/openai.yaml",
        ".agents/skills/storyworld-repository-orientation/references/checklist.md",
        ".agents/skills/storyworld-repository-orientation/references/failure-cases.md",
        ".agents/skills/storyworld-repository-orientation/references/output-contract.md",
        ".agents/skills/storyworld-repository-orientation/references/provenance.json"
      ]
    },
    {
      "id": "storyworld-governed-change",
      "version": "1.0.0",
      "display_name": "Storyworld Governed Change",
      "description": "Deliver one authorized Storyworld repository change with task scope, decision traceability, tests, evidence, and safe closure.",
      "purpose": "Standardize the lifecycle of significant repository-local changes while preserving unrelated work and Storyworld's governance boundaries.",
      "category": "governance",
      "tier": "foundation",
      "priority": "P0",
      "adoption_wave": "A-governance-foundation",
      "adoption_status": "generated_unadopted_baseline",
      "permission_grant": false,
      "side_effects": "repository_local_as_authorized_by_current_task",
      "entrypoint": ".agents/skills/storyworld-governed-change/SKILL.md",
      "dependencies": [
        "storyworld-repository-orientation",
        "storyworld-decision-impact-analysis",
        "storyworld-conformance-and-release"
      ],
      "decisions": [],
      "contracts": [],
      "pocs": [],
      "repository_paths": [
        ".agent/tasks/",
        ".agent/evidence/",
        ".agent/validators.json",
        ".agent/scripts/refresh.py",
        ".agent/scripts/validate.py"
      ],
      "profiles": [],
      "files": [
        ".agents/skills/storyworld-governed-change/SKILL.md",
        ".agents/skills/storyworld-governed-change/agents/openai.yaml",
        ".agents/skills/storyworld-governed-change/references/checklist.md",
        ".agents/skills/storyworld-governed-change/references/failure-cases.md",
        ".agents/skills/storyworld-governed-change/references/output-contract.md",
        ".agents/skills/storyworld-governed-change/references/provenance.json"
      ]
    },
    {
      "id": "storyworld-decision-impact-analysis",
      "version": "1.0.0",
      "display_name": "Storyworld Decision Impact Analysis",
      "description": "Analyze whether a Storyworld change clarifies, amends, supersedes, or requires a successor to accepted or staged decisions, then map all affected artifacts.",
      "purpose": "Prevent architecture and authority changes from entering through implementation, schema, or UI changes without explicit decision disposition.",
      "category": "governance",
      "tier": "foundation",
      "priority": "P0",
      "adoption_wave": "A-governance-foundation",
      "adoption_status": "generated_unadopted_baseline",
      "permission_grant": false,
      "side_effects": "read_only",
      "entrypoint": ".agents/skills/storyworld-decision-impact-analysis/SKILL.md",
      "dependencies": [],
      "decisions": [
        "ADR-0015",
        "DEC-0012",
        "DEC-0015",
        "DEC-0017",
        "DEC-0021",
        "DEC-0028",
        "DEC-0031",
        "DEC-0032",
        "DEC-0033"
      ],
      "contracts": [],
      "pocs": [],
      "repository_paths": [
        ".agent/decisions/",
        "packages/contracts/adr/",
        "packages/contracts/charter/authority-matrix.json",
        "project-dossier-intake/draft-decisions/"
      ],
      "profiles": [],
      "files": [
        ".agents/skills/storyworld-decision-impact-analysis/SKILL.md",
        ".agents/skills/storyworld-decision-impact-analysis/agents/openai.yaml",
        ".agents/skills/storyworld-decision-impact-analysis/references/checklist.md",
        ".agents/skills/storyworld-decision-impact-analysis/references/failure-cases.md",
        ".agents/skills/storyworld-decision-impact-analysis/references/output-contract.md",
        ".agents/skills/storyworld-decision-impact-analysis/references/provenance.json"
      ]
    },
    {
      "id": "storyworld-dossier-intake-maintenance",
      "version": "1.0.0",
      "display_name": "Storyworld Dossier Intake Maintenance",
      "description": "Maintain Storyworld's staged project-dossier-intake artifacts, manifest, impact map, evidence, assessments, and draft decisions without changing governed authority.",
      "purpose": "Turn research and owner direction into a traceable staged package ready for project-owner disposition.",
      "category": "dossier",
      "tier": "foundation",
      "priority": "P0",
      "adoption_wave": "A-governance-foundation",
      "adoption_status": "generated_unadopted_baseline",
      "permission_grant": false,
      "side_effects": "repository_local_as_authorized_by_current_task",
      "entrypoint": ".agents/skills/storyworld-dossier-intake-maintenance/SKILL.md",
      "dependencies": [
        "storyworld-repository-orientation",
        "storyworld-decision-impact-analysis",
        "storyworld-conformance-and-release"
      ],
      "decisions": [],
      "contracts": [],
      "pocs": [],
      "repository_paths": [
        "project-dossier-intake/readme.md",
        "project-dossier-intake/canonical-impact-map.md",
        "project-dossier-intake/draft-decisions/",
        "project-dossier/machine-readable/artifact-registry.json"
      ],
      "profiles": [],
      "files": [
        ".agents/skills/storyworld-dossier-intake-maintenance/SKILL.md",
        ".agents/skills/storyworld-dossier-intake-maintenance/agents/openai.yaml",
        ".agents/skills/storyworld-dossier-intake-maintenance/references/checklist.md",
        ".agents/skills/storyworld-dossier-intake-maintenance/references/failure-cases.md",
        ".agents/skills/storyworld-dossier-intake-maintenance/references/output-contract.md",
        ".agents/skills/storyworld-dossier-intake-maintenance/references/provenance.json"
      ]
    },
    {
      "id": "storyworld-contract-authoring",
      "version": "1.0.0",
      "display_name": "Storyworld Contract Authoring",
      "description": "Design and author Storyworld-owned contracts with explicit authority, lifecycle, versioning, security, fixtures, and tests.",
      "purpose": "Create durable provider-, editor-, renderer-, and runtime-neutral contracts rather than allowing implementation formats to become Storyworld semantics.",
      "category": "contracts",
      "tier": "foundation",
      "priority": "P0",